{
  "$schema": "https://json-schema.org/draft/2020-12/schema",
  "$id": "https://github.com/joshualikaist/Babdoduk/schemas/kaist-menu-day.schema.json",
  "title": "One day of KAIST cafeteria menus: data/kaist-menu/YYYY-MM-DD.json and latest.json",
  "description": "Written by scripts/refresh_kaist_menu.py for the current week only; latest.json is a byte-identical copy of today's file. Read by ggongbab.html#menu, the home page and the magazine's #what section. validate_content.py adds the date, count and coverage rules.",
  "type": "object",
  "required": ["date", "dateLabel", "fetchedAt", "source", "restaurants"],
  "additionalProperties": false,
  "properties": {
    "schemaVersion": {"type": "integer", "const": 1},
    "date": {"type": "string", "pattern": "^\\d{4}-\\d{2}-\\d{2}$"},
    "dateLabel": {"type": "string", "minLength": 1},
    "fetchedAt": {"type": "string", "pattern": "^\\d{4}-\\d{2}-\\d{2}T\\d{2}:\\d{2}:\\d{2}(\\.\\d+)?\\+09:00$"},
    "source": {"type": "string", "pattern": "^https://www\\.kaist\\.ac\\.kr/"},
    "status": {"const": "AVAILABLE"},
    "coverage": {
      "type": "object",
      "required": ["requested", "fetched", "failed", "carried"],
      "additionalProperties": false,
      "properties": {
        "requested": {"type": "integer", "minimum": 0},
        "fetched": {"type": "integer", "minimum": 0},
        "failed": {"type": "array", "items": {"type": "string"}},
        "carried": {"type": "array", "items": {"type": "string"}}
      }
    },
    "restaurants": {"type": "array", "minItems": 1, "items": {"$ref": "#/$defs/restaurant"}}
  },
  "$defs": {
    "restaurant": {
      "type": "object",
      "required": ["id", "name", "building", "breakfast", "lunch", "dinner"],
      "additionalProperties": false,
      "properties": {
        "id": {"type": "string", "pattern": "^[a-z0-9]+$"},
        "name": {"type": "string", "minLength": 1},
        "building": {"type": "string"},
        "breakfast": {"$ref": "#/$defs/meal"},
        "lunch": {"$ref": "#/$defs/meal"},
        "dinner": {"$ref": "#/$defs/meal"}
      }
    },
    "meal": {
      "type": "object",
      "required": ["items", "price", "kcal", "hours"],
      "additionalProperties": false,
      "properties": {
        "items": {"type": "array", "maxItems": 16, "items": {"type": "string", "minLength": 1}},
        "price": {"type": "string"},
        "kcal": {"type": "string"},
        "hours": {"type": "string"}
      }
    }
  }
}
