{
  "date": "2026-10-04",
  "dateLabel": "10월 4일",
  "fetchedAt": "2026-09-29T09:45:27+09:00",
  "source": "https://www.kaist.ac.kr/kr/html/campus/053001.html",
  "status": "AVAILABLE",
  "coverage": {
    "requested": 8,
    "fetched": 8,
    "failed": [],
    "carried": []
  },
  "restaurants": [
    {
      "id": "fclt",
      "name": "카이마루 N11",
      "building": "N11",
      "breakfast": {
        "hours": "",
        "items": [
          "쌀밥",
          "유부우동국물(5,6)",
          "소떡강정",
          "콩자반(5)",
          "맛김치(5,6,9,13)",
          "도시락김/숭늉",
          "(671Kcal)"
        ],
        "price": "3,500원",
        "kcal": ""
      },
      "lunch": {
        "hours": "",
        "items": [
          "쌀밥",
          "근대된장국(5,6)",
          "블랙페퍼닭살볶음(5,6,15)",
          "건파래볶음",
          "콩나물무침(5)",
          "맛김치(5,6,9,13)",
          "야채샐러드&드레싱(1,2,5,6)",
          "(1293Kcal)"
        ],
        "price": "5,500원",
        "kcal": ""
      },
      "dinner": {
        "hours": "",
        "items": [
          "쌀밥",
          "육개장(5,6,16)",
          "양송이소스함박",
          "떠먹는봉골레파스타(5,6,18)",
          "치커리겉절이(5,6,9,13)",
          "깍두기(5,6,9,13)",
          "야채샐러드&드레싱(1,2,5,6)",
          "(1285Kcal)"
        ],
        "price": "5,500원",
        "kcal": ""
      }
    },
    {
      "id": "east1",
      "name": "동맛골 학생식당 E5",
      "building": "E5",
      "breakfast": {
        "hours": "",
        "items": [
          "소세지핫도그2,5,10,12,15,16,1,6",
          "크루통양송이스프2,5,6,15,16",
          "스크램블에그1,5",
          "리코타그린샐러드 2,5,13,1",
          "씨리얼*우유5,2"
        ],
        "price": "",
        "kcal": "805 kcal"
      },
      "lunch": {
        "hours": "",
        "items": [
          "(뚝)들깨감자옹심이수제비5,6",
          "쌀밥",
          "만두강정2,5,6,10,15,16,12,18",
          "잡채어묵*머스타드5,6,16,1,2",
          "얼갈이무침,5,6",
          "깍두기2,5,6,9,12,15,16,18"
        ],
        "price": "",
        "kcal": "1053 kcal"
      },
      "dinner": {
        "hours": "",
        "items": [
          "쌀밥",
          "맑은콩나물국5,6",
          "불맛돈육볶음5,6,16,10",
          "깐풍기칠리조림5,6,15,12",
          "참나물발사믹무침5,6,13",
          "배추김치6,9"
        ],
        "price": "",
        "kcal": "890 kcal"
      }
    },
    {
      "id": "icc",
      "name": "문지캠퍼스",
      "building": "문지",
      "breakfast": {
        "hours": "",
        "items": [],
        "price": "",
        "kcal": ""
      },
      "lunch": {
        "hours": "",
        "items": [
          "백미밥",
          "미역국(5,6)",
          "콩나물불고기(5,6,10)",
          "꽈리고추어묵볶음(1,5,6,9)",
          "브로콜리/초장(5,6)",
          "배추김치",
          "[칼로리:855kcal]"
        ],
        "price": "",
        "kcal": ""
      },
      "dinner": {
        "hours": "",
        "items": [
          "백미밥",
          "순두부찌개(1,5,6)",
          "안동찜닭(5,6,15*)",
          "김말이강정(5,6)",
          "오이부추무침(5,6)",
          "배추김치",
          "[칼로리:1,110kcal]"
        ],
        "price": "",
        "kcal": ""
      }
    },
    {
      "id": "hawam",
      "name": "화암 기숙사",
      "building": "화암",
      "breakfast": {
        "hours": "",
        "items": [],
        "price": "",
        "kcal": ""
      },
      "lunch": {
        "hours": "",
        "items": [
          "백미밥",
          "미역국(5,6)",
          "콩나물불고기(5,6,10)",
          "꽈리고추어묵볶음(1,5,6,9)",
          "브로콜리/초장(5,6)",
          "배추김치",
          "[칼로리:855kcal]"
        ],
        "price": "",
        "kcal": ""
      },
      "dinner": {
        "hours": "",
        "items": [
          "백미밥",
          "순두부찌개(1,5,6)",
          "안동찜닭(5,6,15*)",
          "김말이강정(5,6)",
          "오이부추무침(5,6)",
          "배추김치",
          "[칼로리:1,110kcal]"
        ],
        "price": "",
        "kcal": ""
      }
    }
  ]
}
