{
  "date": "2026-09-24",
  "dateLabel": "9월 24일",
  "fetchedAt": "2026-09-24T08:22:30+09:00",
  "source": "https://www.kaist.ac.kr/kr/html/campus/053001.html",
  "restaurants": [
    {
      "id": "west",
      "name": "서맛골 W2",
      "building": "W2",
      "breakfast": {
        "hours": "",
        "items": [
          "백미밥",
          "시래기된장국 (5,6)",
          "두부전&양념장 (1,5,6)",
          "간장깻잎지 (5,6)",
          "도시락김 (5,6)",
          "배추김치 (5,9)",
          "누룽지"
        ],
        "price": "",
        "kcal": "785 kcal"
      },
      "lunch": {
        "hours": "",
        "items": [
          "백미밥",
          "순두부백탕 (5,6)",
          "닭갈비 (5,6,15)",
          "도토리묵&간장 (5,6)",
          "콩나물무침 (5,6)",
          "배추김치 (5,9)",
          "양배추채샐러드&드레싱 (1,6)"
        ],
        "price": "",
        "kcal": "850 kcal"
      },
      "dinner": {
        "hours": "",
        "items": [
          "백미밥",
          "참치미역국 (5,6,7)",
          "간장불고기 (5,6,10)",
          "청포묵숙주무침 (5,6)",
          "비타장아찌 (5,6)",
          "배추김치 (5,9)",
          "양배추샐러드&드레싱 (1,6)"
        ],
        "price": "",
        "kcal": "850 kcal"
      }
    }
  ]
}
