{
  "date": "2026-09-26",
  "dateLabel": "9월 26일",
  "fetchedAt": "2026-09-26T15:28:57+09:00",
  "source": "https://www.kaist.ac.kr/kr/html/campus/053001.html",
  "restaurants": [
    {
      "id": "west",
      "name": "서맛골 W2",
      "building": "W2",
      "breakfast": {
        "hours": "",
        "items": [
          "백미밥",
          "북어채무국 (5,6)",
          "모둠장조림 (1,5,6,10)",
          "무생채 (5,6)",
          "도시락김 (5,6)",
          "배추김치 (5,9)",
          "누룽지"
        ],
        "price": "",
        "kcal": "785 kcal"
      },
      "lunch": {
        "hours": "",
        "items": [
          "백미밥",
          "유부두부된장국 (5,6)",
          "간장찜닭 (5,6,15)",
          "어묵볶음 (5,6)",
          "브로콜리마늘쫑볶음 (5,6)",
          "배추김치 (5,9)",
          "양배추채샐러드&드레싱 (1,6)"
        ],
        "price": "",
        "kcal": "850 kcal"
      },
      "dinner": {
        "hours": "",
        "items": [
          "백미밥",
          "감자호박수제비 (1,5,6)",
          "돈육오징어볶음 (5,6,10,17)",
          "콩나물무침 (5,6)",
          "단무지무침 (5,6)",
          "배추김치 (5,9)",
          "양배추채샐러드&드레싱 (1,6)"
        ],
        "price": "",
        "kcal": "850 kcal"
      }
    }
  ]
}
