{
  "schemaVersion": 1,
  "date": "2026-10-28",
  "dateLabel": "10월 28일",
  "fetchedAt": "2026-10-27T09:05:19+09:00",
  "source": "https://www.kaist.ac.kr/kr/html/campus/053001.html",
  "status": "AVAILABLE",
  "coverage": {
    "requested": 8,
    "fetched": 8,
    "failed": [],
    "carried": []
  },
  "restaurants": [
    {
      "id": "fclt",
      "name": "카이마루 N11",
      "building": "N11",
      "breakfast": {
        "hours": "",
        "items": [
          "천원의 아침밥(1,000원) / 대학생, 대학원 재학생 대상 / 조식(3,500원) /*교직원 및 일반인에게는 과일제공이 제한됩니다.",
          "쌀밥",
          "오징어두부국(5,6,17)",
          "계란찜(1)",
          "시래기된장지짐(5,6)",
          "맛김치(5,6,9,13)",
          "도시락김/숭늉",
          "(668Kcal)"
        ],
        "price": "1,000원",
        "kcal": ""
      },
      "lunch": {
        "hours": "",
        "items": [
          "자율코너(5,500원)",
          "쌀밥/흑미밥",
          "얼큰무채국",
          "제육야채볶음(5,6,10)",
          "에그누들팟타이(1,5,6,18)",
          "돈나물간장무침",
          "맛김치(5,6,9,13)",
          "야채샐러드&드레싱(1,2,5,6)",
          "(1304Kcal)",
          "A코너(6,000원)",
          "텐동덮밥(1,2,5,6,8,9)",
          "미니온소바(1,3,5,6,10)",
          "야채샐러드&드레싱(1,2,5,6)",
          "(1187Kcal)",
          "B코너(6,000원)",
          "직화]돌솥비빔밥*계란후라이(1,5,6)"
        ],
        "price": "5,500원",
        "kcal": ""
      },
      "dinner": {
        "hours": "",
        "items": [
          "쌀밥",
          "대파육개장(5,6,16)",
          "투움바고기산적조림(1,2,5,6,10,15)",
          "들기름막송이",
          "치커리유자청무침",
          "맛김치(5,6,9,13)",
          "야채샐러드&드레싱(1,2,5,6)",
          "(1285Kcal)"
        ],
        "price": "5,500원",
        "kcal": ""
      }
    },
    {
      "id": "west",
      "name": "서맛골 W2",
      "building": "W2",
      "breakfast": {
        "hours": "",
        "items": [
          "백미밥",
          "맑은콩나물국(5)",
          "동그랑땡전(1, 5, 6, 10)",
          "건새우마늘쫑볶음(9)",
          "도시락김(5,6)",
          "배추김치(5,9)",
          "누룽지",
          "★하루과일 캠페인은 동문 및 학부모님 등의 후원으로 제공됩니다.(주관: 글로벌리더십센터) ★",
          "★천원의 아침밥★",
          "- 식사시 학생증 및 모바일 학생증 소지 부탁 드립니다."
        ],
        "price": "",
        "kcal": "750 kcal"
      },
      "lunch": {
        "hours": "",
        "items": [
          "백미밥",
          "바지락수제비국(18)",
          "간장불고기(5,6,10)",
          "청경채나물",
          "무생채",
          "배추김치(5,9)",
          "양배추샐러드&드레싱",
          "일품[6,500원]",
          "뚝)순대국밥&소면사리(1, 5, 6, 10)",
          "추가밥",
          "부추겉절이",
          "석박지(5,9)",
          "양배추샐러드&드레싱(1, 6)"
        ],
        "price": "6,500원",
        "kcal": "950 kcal"
      },
      "dinner": {
        "hours": "",
        "items": [
          "백미밥",
          "김치어묵국(5, 6,9)",
          "허브솔트돈육구이(10)",
          "콩나물무침(5)",
          "수제양파고추지",
          "배추김치(5,9)",
          "양배추샐러드&드레싱(1, 6)",
          "일품[6,500원]",
          "잠발라야볶음밥(1, 5, 6, 9,10)",
          "오징어튀김(1, 5, 6, 17)",
          "우동국물(5, 6)",
          "배추김치(5,9)",
          "양배추샐러드&드레싱(1, 6)",
          "★하루과일 캠페인은 동문 및 학부모님 등의 후원으로 제공됩니다.(주관: 글로벌리더십센터) ★"
        ],
        "price": "6,500원",
        "kcal": "800 kcal"
      }
    },
    {
      "id": "east1",
      "name": "동맛골 학생식당 E5",
      "building": "E5",
      "breakfast": {
        "hours": "",
        "items": [
          "육개장5,6,15,16,1",
          "쌀밥",
          "메추리알감자조림1,5,6",
          "쥐어채볶음5,6",
          "고추지무침13",
          "배추김치6,9",
          "●하루과일 캠페인은 동문 및 학부모님 등의 후원으로 제공됩니다.(주관: 글로벌리더십센터)"
        ],
        "price": "",
        "kcal": "710 kcal"
      },
      "lunch": {
        "hours": "",
        "items": [
          "(한식)",
          "토마토치즈제육볶음10,12,2,6,5,15,16,18",
          "쌀밥",
          "우동국물5,6,7,1",
          "후랑크간장볶음15,10,5,6,16,2,18",
          "치커리유자청무침",
          "배추김치6,9",
          "그린샐러드*드레싱5,1,2,13,6,4",
          "(일품)",
          "마제소바비빔면5,6,2,10",
          "후리가케밥13,5,6",
          "우동국물5,6,7,1",
          "야채민찌까스*소스15,10,5,6",
          "배추김치6,9",
          "그린샐러드*드레싱5,1,2,13,6,4",
          "(샐러드)"
        ],
        "price": "",
        "kcal": "254 kcal"
      },
      "dinner": {
        "hours": "",
        "items": [
          "훈제오리김치볶음밥5,2",
          "들깨미역국5,6",
          "새우튀김3개씩*치폴레소스9,5,6,1,12",
          "새송이굴소스조림5,6,13,18,16",
          "열무김치5,6,2,9,7,16,18(열무:국산, 고추분:중국산)",
          "●고객경영팀에서 학생들의 건강을 위해 과일을 제공합니다."
        ],
        "price": "",
        "kcal": "853 kcal"
      }
    },
    {
      "id": "east2",
      "name": "동맛골 교직원식당 E5",
      "building": "E5",
      "breakfast": {
        "hours": "",
        "items": [],
        "price": "",
        "kcal": ""
      },
      "lunch": {
        "hours": "",
        "items": [
          "(한식)",
          "토마토치즈제육볶음10,12,2,6,5,15,16,18",
          "쌀밥",
          "우동국물5,6,7,1",
          "후랑크간장볶음15,10,5,6,16,2,18",
          "치커리유자청무침",
          "배추김치6,9",
          "크리스피롤과자1,5,6,3",
          "그린샐러드*드레싱5,1,2,13,6,4",
          "(솥밥)",
          "치즈붉닭솥밥15,5,6,12,16,18,13,2",
          "우동국물5,6,7,1",
          "오징어젓갈무침17",
          "무조미도시락김",
          "배추김치6,9"
        ],
        "price": "",
        "kcal": "1012 kcal"
      },
      "dinner": {
        "hours": "",
        "items": [
          "훈제오리김치볶음밥5,2",
          "들깨미역국5,6",
          "새우튀김3개씩*치폴레소스9,5,6,1,12",
          "새송이굴소스조림5,6,13,18,16",
          "열무김치5,6,2,9,7,16,18(열무:국산, 고추분:중국산)",
          "가지볶음5,6"
        ],
        "price": "",
        "kcal": "853 kcal"
      }
    },
    {
      "id": "emp",
      "name": "교수회관 N6",
      "building": "N6",
      "breakfast": {
        "hours": "",
        "items": [],
        "price": "",
        "kcal": ""
      },
      "lunch": {
        "hours": "",
        "items": [
          "1층 자율배식",
          "(5,500원)",
          "쌀밥",
          "어묵김치국(5,6,9,13)",
          "미니돈까스&케찹(1,5,6,10,12,15)",
          "두부조림(5)",
          "숙주나물(5)",
          "깍두기(9,13)",
          "그린샐러드&드레싱(1,5,6)",
          "(1085kcal)",
          "2층 자율배식",
          "(6,500원)",
          "어묵김치국",
          "미니돈까스&케찹(1,2,5,6,10)",
          "소보로비빔밥&고추장(1,5,6,16)",
          "숙주나물(5)"
        ],
        "price": "5,500원",
        "kcal": ""
      },
      "dinner": {
        "hours": "",
        "items": [
          "자율배식",
          "(5,500원)",
          "쌀밥",
          "시금치된장국(5)",
          "두반장제육볶음(5,6,10)",
          "우엉채조림",
          "열무겉절이",
          "맛김치(9,13)",
          "그린샐러드&드레싱(1,5,6)",
          "(1058kcal)"
        ],
        "price": "5,500원",
        "kcal": ""
      }
    },
    {
      "id": "icc",
      "name": "문지캠퍼스",
      "building": "문지",
      "breakfast": {
        "hours": "",
        "items": [
          "백미밥",
          "참치김치찌개(5,6)",
          "돈육메알장조림(1,5,6,10)",
          "두부계란부침(1,5,6)",
          "도시락김",
          "배추김치",
          "[칼로리:790kcal]"
        ],
        "price": "",
        "kcal": ""
      },
      "lunch": {
        "hours": "",
        "items": [
          "백미밥",
          "버섯된장찌개(5,6)",
          "고추장불고기(5,6,10)",
          "햄감자채볶음(5,6,10,15*)",
          "케이준치킨샐러드(1,2,5,6,15)",
          "배추김치",
          "[칼로리:1,050kcal]"
        ],
        "price": "",
        "kcal": ""
      },
      "dinner": {
        "hours": "",
        "items": [
          "백미밥",
          "어묵무국(5,6,18)",
          "언양식불고기(5,6,10,16)",
          "생선까스/타르소스(1,2,5,6,18)",
          "콩나물부추무침(5,6)",
          "배추김치",
          "[칼로리:1,110kcal]"
        ],
        "price": "",
        "kcal": ""
      }
    },
    {
      "id": "hawam",
      "name": "화암 기숙사",
      "building": "화암",
      "breakfast": {
        "hours": "",
        "items": [
          "백미밥",
          "참치김치찌개(5,6)",
          "돈육메알장조림(1,5,6,10)",
          "두부계란부침(1,5,6)",
          "도시락김",
          "배추김치",
          "[칼로리:790kcal]"
        ],
        "price": "",
        "kcal": ""
      },
      "lunch": {
        "hours": "",
        "items": [
          "백미밥",
          "버섯된장찌개(5,6)",
          "고추장불고기(5,6,10)",
          "햄감자채볶음(5,6,10,15*)",
          "케이준치킨샐러드(1,2,5,6,15)",
          "배추김치",
          "[칼로리:1,050kcal]"
        ],
        "price": "",
        "kcal": ""
      },
      "dinner": {
        "hours": "",
        "items": [
          "백미밥",
          "어묵무국(5,6,18)",
          "언양식불고기(5,6,10,16)",
          "생선까스/타르소스(1,2,5,6,18)",
          "콩나물부추무침(5,6)",
          "배추김치",
          "[칼로리:1,110kcal]"
        ],
        "price": "",
        "kcal": ""
      }
    },
    {
      "id": "seoul",
      "name": "서울캠퍼스",
      "building": "서울",
      "breakfast": {
        "hours": "",
        "items": [],
        "price": "",
        "kcal": ""
      },
      "lunch": {
        "hours": "",
        "items": [
          "2층",
          "1코너",
          "부대찌개",
          "잡곡밥",
          "생선까스",
          "감자간장조림",
          "오이양파장아찌",
          "깍두기",
          "2코너",
          "참치생야채비빔밥",
          "유부된장국",
          "소떡소떡꼬치",
          "오이양파장아찌",
          "깍두기",
          "4층",
          "홍합어묵탕"
        ],
        "price": "",
        "kcal": ""
      },
      "dinner": {
        "hours": "",
        "items": [
          "우거지순대국",
          "쌀밥",
          "두부양념조림",
          "호박버섯볶음",
          "고춧잎무침",
          "깍두기"
        ],
        "price": "",
        "kcal": ""
      }
    }
  ]
}
