{
  "date": "2026-10-09",
  "dateLabel": "10월 9일",
  "fetchedAt": "2026-10-08T23:47:11+09:00",
  "source": "https://www.kaist.ac.kr/kr/html/campus/053001.html",
  "status": "AVAILABLE",
  "coverage": {
    "requested": 8,
    "fetched": 8,
    "failed": [],
    "carried": []
  },
  "restaurants": [
    {
      "id": "fclt",
      "name": "카이마루 N11",
      "building": "N11",
      "breakfast": {
        "hours": "",
        "items": [
          "쌀밥",
          "얼갈이된장국(5,6)",
          "야채계란찜(1)",
          "오이지무침(13)",
          "맛김치(5,6,9,13)",
          "도시락김/숭늉",
          "(665kcal)"
        ],
        "price": "3,500원",
        "kcal": ""
      },
      "lunch": {
        "hours": "",
        "items": [
          "자율배식(5,500원)",
          "쌀밥",
          "뼈없는감자탕(5,6,10,16)",
          "어니언치킨너겟(1,5,6,15)",
          "크림카레당면볶음(5,6)",
          "부추적채무침",
          "맛김치(5,6,9,13)",
          "야채샐러드&드레싱(1,2,5,6)",
          "(1301kcal)"
        ],
        "price": "5,500원",
        "kcal": ""
      },
      "dinner": {
        "hours": "",
        "items": [
          "쌀밥",
          "미역국",
          "고추잡채(5,6,10,18)",
          "알감자조림(5,6)",
          "얼갈이겉절이",
          "깍두기(5,6,9,13)",
          "야채샐러드&드레싱(1,2,5,6)",
          "(1277kcal)"
        ],
        "price": "5,500원",
        "kcal": ""
      }
    },
    {
      "id": "west",
      "name": "서맛골 W2",
      "building": "W2",
      "breakfast": {
        "hours": "",
        "items": [
          "백미밥",
          "무채들깨국",
          "계란후라이2개&케찹(1,12)",
          "양념깻잎지(5,6)",
          "도시락김(5,6)",
          "배추김치(5,9)",
          "누룽지"
        ],
        "price": "",
        "kcal": "720 kcal"
      },
      "lunch": {
        "hours": "",
        "items": [
          "백미밥",
          "순두부백탕(5)",
          "닭갈비(5,6,15)",
          "브로콜리&초장(5,6)",
          "콩나물무침(5)",
          "배추김치(5,9)",
          "양배추샐러드&드레싱(1,6)"
        ],
        "price": "",
        "kcal": "760 kcal"
      },
      "dinner": {
        "hours": "",
        "items": [
          "짜장라이스(5, 6,10,15,16)",
          "짬뽕국(5,6,9,10,17,18,21)",
          "탕수육&소스(6, 10)",
          "해초샐러드",
          "짜사이무침",
          "배추김치 (5,9)",
          "양배추샐러드&드레싱(1, 6)"
        ],
        "price": "",
        "kcal": "930 kcal"
      }
    },
    {
      "id": "east1",
      "name": "동맛골 학생식당 E5",
      "building": "E5",
      "breakfast": {
        "hours": "",
        "items": [
          "토스트*딸기잼2,5,6",
          "감자스프1,5,6,16",
          "계란후라이1,5",
          "칼집비엔나구이12,5,6,15,16",
          "시저샐러드1,12,2,5,6,10,16,13",
          "씨리얼*우유5,2"
        ],
        "price": "",
        "kcal": "750 kcal"
      },
      "lunch": {
        "hours": "",
        "items": [
          "쌀밥",
          "우렁된장국5,6,18",
          "깻잎제육볶음5,6,10",
          "햄마늘종볶음2,5,6,10,15",
          "고춧잎무침5,6",
          "배추김치6,9 , 그린샐러드*드레싱1,2,5,6,13,18"
        ],
        "price": "",
        "kcal": "1150 kcal"
      },
      "dinner": {
        "hours": "",
        "items": [
          "\"쌀밥",
          "돈육고추장찌개5,6,10",
          "고등어구이 7,5",
          "스크램블에그 1,5",
          "배추나물5,6",
          "깍두기5,6,2,9,16,15,12,18"
        ],
        "price": "",
        "kcal": "910 kcal"
      }
    },
    {
      "id": "icc",
      "name": "문지캠퍼스",
      "building": "문지",
      "breakfast": {
        "hours": "",
        "items": [],
        "price": "",
        "kcal": ""
      },
      "lunch": {
        "hours": "",
        "items": [
          "백미밥",
          "유부무국(5,6)",
          "닭볶음탕(5,6,15*)",
          "연두부/양념장(5,6)",
          "오이부추무침(5,6)",
          "배추김치",
          "[칼로리:890kcal]"
        ],
        "price": "",
        "kcal": ""
      },
      "dinner": {
        "hours": "",
        "items": [
          "백미밥",
          "떡만둣국(1,2,5,6,10)",
          "훈제오리야채볶음(5,6)",
          "고로케(5,6)",
          "양배추샐러드(1,2,5,6)",
          "배추김치",
          "[칼로리:910kcal]"
        ],
        "price": "",
        "kcal": ""
      }
    },
    {
      "id": "hawam",
      "name": "화암 기숙사",
      "building": "화암",
      "breakfast": {
        "hours": "",
        "items": [],
        "price": "",
        "kcal": ""
      },
      "lunch": {
        "hours": "",
        "items": [
          "백미밥",
          "유부무국(5,6)",
          "닭볶음탕(5,6,15*)",
          "연두부/양념장(5,6)",
          "오이부추무침(5,6)",
          "배추김치",
          "[칼로리:890kcal]"
        ],
        "price": "",
        "kcal": ""
      },
      "dinner": {
        "hours": "",
        "items": [
          "백미밥",
          "떡만둣국(1,2,5,6,10)",
          "훈제오리야채볶음(5,6)",
          "고로케(5,6)",
          "양배추샐러드(1,2,5,6)",
          "배추김치",
          "[칼로리:910kcal]"
        ],
        "price": "",
        "kcal": ""
      }
    }
  ]
}
