{
  "schemaVersion": 1,
  "date": "2026-10-30",
  "dateLabel": "10월 30일",
  "fetchedAt": "2026-10-29T16:12:55+09:00",
  "source": "https://www.kaist.ac.kr/kr/html/campus/053001.html",
  "status": "AVAILABLE",
  "coverage": {
    "requested": 8,
    "fetched": 8,
    "failed": [],
    "carried": []
  },
  "restaurants": [
    {
      "id": "fclt",
      "name": "카이마루 N11",
      "building": "N11",
      "breakfast": {
        "hours": "",
        "items": [
          "천원의 아침밥(1,000원) / 대학생, 대학원 재학생 대상 / 조식(3,500원) /*교직원 및 일반인에게는 과일제공이 제한됩니다.",
          "쌀밥",
          "유채된장국(5,6)",
          "쏘야볶음(1,5,6,12,15)",
          "열무겉절이",
          "맛김치(5,6,9,13)",
          "도시락김/숭늉",
          "(667Kcal)"
        ],
        "price": "1,000원",
        "kcal": ""
      },
      "lunch": {
        "hours": "",
        "items": [
          "자율코너(5,500원)",
          "쌀밥/흑미밥",
          "얼큰콩나물국(5)",
          "수제치킨*소스(5,6,12,15) (*치킨은 리필이 불가합니다.)",
          "시금치카레소스(5,6)",
          "핑크색무초절임",
          "맛김치(5,6,9,13)",
          "야채샐러드&드레싱(1,2,5,6)",
          "(1318Kcal)",
          "B코너(6,000원)",
          "직화]돈육김치찌개*라면사리(5,6,9,10,13,16)",
          "대접밥*버터(1,2)",
          "야채샐러드&드레싱(1,2,5,6)",
          "(1154Kcal)"
        ],
        "price": "5,500원",
        "kcal": ""
      },
      "dinner": {
        "hours": "",
        "items": [
          "쌀밥",
          "숙주짬뽕국(5,6,17,18)",
          "어향미트볼가지볶음(5,6,10,15,16,18)",
          "알배기배추구이(2)",
          "청포묵후리가께무침(5,6)",
          "깍두기(5,6,9,13)",
          "야채샐러드&드레싱(1,2,5,6)",
          "(1284Kcal)"
        ],
        "price": "5,500원",
        "kcal": ""
      }
    },
    {
      "id": "west",
      "name": "서맛골 W2",
      "building": "W2",
      "breakfast": {
        "hours": "",
        "items": [
          "백미밥",
          "옹심이만둣국(1, 5, 6)",
          "계란후라이 (1)",
          "숙주나물(5)",
          "도시락김(5,6)",
          "배추김치(5,9)",
          "누룽지",
          "★하루과일 캠페인은 동문 및 학부모님 등의 후원으로 제공됩니다.(주관: 글로벌리더십센터) ★",
          "★천원의 아침밥★",
          "- 식사시 학생증 및 모바일 학생증 소지 부탁 드립니다."
        ],
        "price": "",
        "kcal": "760 kcal"
      },
      "lunch": {
        "hours": "",
        "items": [
          "백미밥",
          "순두부찌개(5, 6)",
          "어니언순살크림닭볶음(1, 5, 6, 15)",
          "어묵채볶음(5, 6)",
          "오이부추무침(5)",
          "배추김치(5,9)",
          "양배추샐러드&드레싱(1, 6)",
          "일품[6,500원]",
          "대패삼겹비빔밥(5, 10)",
          "추가밥",
          "팽이장국(5, 6)",
          "배추김치(5,9)",
          "양배추샐러드&드레싱(1, 6)"
        ],
        "price": "6,500원",
        "kcal": "900 kcal"
      },
      "dinner": {
        "hours": "",
        "items": [
          "짜장라이스(5,6)",
          "쑥갓어묵무국(5, 6)",
          "탕수육&소스 (5,6,10)",
          "다시마초무침(13)",
          "새우젓호박볶음(9)",
          "배추김치(5,9)",
          "양배추샐러드&드레싱(1, 6)"
        ],
        "price": "",
        "kcal": "850 kcal"
      }
    },
    {
      "id": "east1",
      "name": "동맛골 학생식당 E5",
      "building": "E5",
      "breakfast": {
        "hours": "",
        "items": [
          "프렌치토스트*메이플시럽5,6,2,1",
          "크루통콘스프5,6,2,16,15",
          "계란후라이1,5",
          "비엔나양파볶음5,6,10,15,16(계육,돈육:국산)",
          "시저샐러드1,12,2,5,10,16,6(베이컨/돈육:외국산)",
          "씨리얼*우유5,6,2",
          "●하루과일 캠페인은 동문 및 학부모님 등의 후원으로 제공됩니다.(주관: 글로벌리더십센터)"
        ],
        "price": "",
        "kcal": "698 kcal"
      },
      "lunch": {
        "hours": "",
        "items": [
          "(한식)",
          "고사리간장제육볶음10,5,6,2,16,13",
          "쌀밥",
          "두부된장국5,6",
          "매콤김떡만5,6,16,2,12,16,4,15",
          "모듬채소겉절이5,6,13,18",
          "깍두기2,5,6,9,12,15,16,18",
          "그린샐러드*드레싱5,1,2,13,6,4",
          "(일품)",
          "김치치즈함박2,5,6,10,15,16,9,12,18",
          "추가밥",
          "두부된장국5,6",
          "카스테라꽈배기5,2,6,1",
          "깍두기2,5,6,9,12,15,16,18",
          "그린샐러드*드레싱5,1,2,13,6,4",
          "(샐러드)"
        ],
        "price": "",
        "kcal": "530 kcal"
      },
      "dinner": {
        "hours": "",
        "items": [
          "중화제육덮밥18,1,15,5,6,17,10,16",
          "유부장국5,6",
          "갈비맛고기강정10,5,6,4,16,18",
          "명엽채조림5,6",
          "배추김치6,9"
        ],
        "price": "",
        "kcal": "955 kcal"
      }
    },
    {
      "id": "east2",
      "name": "동맛골 교직원식당 E5",
      "building": "E5",
      "breakfast": {
        "hours": "",
        "items": [],
        "price": "",
        "kcal": ""
      },
      "lunch": {
        "hours": "",
        "items": [
          "(한식)",
          "고사리간장제육볶음10,5,6,2,16,13",
          "쌀밥",
          "두부된장국5,6",
          "매콤김떡만5,6,16,2,12,16,4,15",
          "모듬채소겉절이5,6,13,18",
          "깍두기2,5,6,9,12,15,16,18",
          "상추쌈*쌈장5,6",
          "그린샐러드*드레싱5,1,2,13,6,4",
          "(솥밥)",
          "쫄떼기살묵은지찜솥밥10,5,6,9",
          "두부된장국5,6",
          "오징어젓갈무침17",
          "무조미도시락김",
          "배추김치6,9"
        ],
        "price": "",
        "kcal": "954 kcal"
      },
      "dinner": {
        "hours": "",
        "items": [
          "중화제육덮밥18,1,15,5,6,17,10,16",
          "유부장국5,6",
          "갈비맛고기강정10,5,6,4,16,18",
          "명엽채조림5,6",
          "배추김치6,9",
          "감자채피망볶음"
        ],
        "price": "",
        "kcal": "955 kcal"
      }
    },
    {
      "id": "emp",
      "name": "교수회관 N6",
      "building": "N6",
      "breakfast": {
        "hours": "",
        "items": [],
        "price": "",
        "kcal": ""
      },
      "lunch": {
        "hours": "",
        "items": [
          "1층 자율배식",
          "(5,500원)",
          "쌀밥",
          "청양된장찌개(5)",
          "오징어해물까스&소스(1,2,5,6,17)",
          "콩자반(13)",
          "새콤오이무침",
          "맛김치(9,13)",
          "그린샐러드&드레싱(1,5,6)",
          "(1087kcal)",
          "2층 자율배식",
          "(6,500원)",
          "쌀밥",
          "청양된장찌개(5)",
          "오징어해물까스&소스(1,2,5,6,17)",
          "묵은지닭살볶음(5,6,9,13,15)"
        ],
        "price": "5,500원",
        "kcal": ""
      },
      "dinner": {
        "hours": "",
        "items": [
          "자율배식",
          "(5,500원)",
          "쌀밥",
          "감자고추장찌개(5)",
          "동그랑땡조림(5,6,10,15,18)",
          "계란찜(1ps)(1)",
          "얼갈이겉절이",
          "맛김치(9,13)",
          "그린샐러드&드레싱(1,5,6)",
          "(1066kcal)"
        ],
        "price": "5,500원",
        "kcal": ""
      }
    },
    {
      "id": "icc",
      "name": "문지캠퍼스",
      "building": "문지",
      "breakfast": {
        "hours": "",
        "items": [
          "백미밥",
          "근대된장국(5,6)",
          "제육볶음(5,6,10)",
          "멸치볶음(5,6,18)",
          "도시락김",
          "배추김치",
          "[칼로리:810kcal]"
        ],
        "price": "",
        "kcal": ""
      },
      "lunch": {
        "hours": "",
        "items": [
          "백미밥",
          "유부무국(5,6)",
          "고구마닭갈비(5,6,15)",
          "김말이강정(1,5,6)",
          "도토리묵무침(5,6)",
          "배추김치",
          "[칼로리:930kcal]"
        ],
        "price": "",
        "kcal": ""
      },
      "dinner": {
        "hours": "",
        "items": [
          "백미밥",
          "물만둣국(1,5,6,10)",
          "훈제오리구이(5,6)",
          "고구마맛탕(5,6)",
          "양배추샐러드(1,2,5,6)",
          "배추김치",
          "[칼로리:940kcal]"
        ],
        "price": "",
        "kcal": ""
      }
    },
    {
      "id": "hawam",
      "name": "화암 기숙사",
      "building": "화암",
      "breakfast": {
        "hours": "",
        "items": [
          "백미밥",
          "근대된장국(5,6)",
          "제육볶음(5,6,10)",
          "멸치볶음(5,6,18)",
          "도시락김",
          "배추김치",
          "[칼로리:810kcal]"
        ],
        "price": "",
        "kcal": ""
      },
      "lunch": {
        "hours": "",
        "items": [
          "백미밥",
          "유부무국(5,6)",
          "고구마닭갈비(5,6,15)",
          "김말이강정(1,5,6)",
          "도토리묵무침(5,6)",
          "배추김치",
          "[칼로리:930kcal]"
        ],
        "price": "",
        "kcal": ""
      },
      "dinner": {
        "hours": "",
        "items": [
          "백미밥",
          "물만둣국(1,5,6,10)",
          "훈제오리구이(5,6)",
          "고구마맛탕(5,6)",
          "양배추샐러드(1,2,5,6)",
          "배추김치",
          "[칼로리:940kcal]"
        ],
        "price": "",
        "kcal": ""
      }
    },
    {
      "id": "seoul",
      "name": "서울캠퍼스",
      "building": "서울",
      "breakfast": {
        "hours": "",
        "items": [],
        "price": "",
        "kcal": ""
      },
      "lunch": {
        "hours": "",
        "items": [
          "2층",
          "쇠고기순두부찌개",
          "잡곡밥",
          "맛살깻잎전",
          "버섯잡채",
          "봄동겉절이",
          "깍두기",
          "4층",
          "묵은지곤드레밥",
          "청양된장찌개",
          "훈제오리구이",
          "버섯잡채",
          "숙주나물무침",
          "열무김치",
          "샐러드*드레싱"
        ],
        "price": "",
        "kcal": ""
      },
      "dinner": {
        "hours": "",
        "items": [
          "오징어야채볶음",
          "쌀밥",
          "냉이된장찌개",
          "소시지야채볶음",
          "콩나물무침",
          "배추김치"
        ],
        "price": "",
        "kcal": ""
      }
    }
  ]
}
