{
  "date": "2026-09-23",
  "dateLabel": "9월 23일",
  "fetchedAt": "2026-09-23T21:55:36+09:00",
  "source": "https://www.kaist.ac.kr/kr/html/campus/053001.html",
  "restaurants": [
    {
      "id": "fclt",
      "name": "카이마루 N11",
      "building": "N11",
      "breakfast": {
        "hours": "",
        "items": [
          "천원의 아침밥(1,000원) / 대학생, 대학원 재학생 대상 / 조식(3,500원) /*교직원 및 일반인에게는 과일제공이 제한됩니다.",
          "쌀밥",
          "얼갈이된장국(5,6)",
          "매콤완자볶음(1,5,6,15)",
          "우엉채조림(5,6)",
          "맛김치(5,6,9,13)",
          "도시락김/숭늉",
          "(714Kcal)"
        ],
        "price": "1,000원",
        "kcal": ""
      },
      "lunch": {
        "hours": "",
        "items": [
          "자율코너(5,500원)",
          "쌀밥/흑미밥",
          "미역국",
          "춘천닭갈비(5,6,15)",
          "옛날소시지전*케찹(1,5,6,12)",
          "청경채겉절이",
          "맛김치(5,6,9,13)",
          "야채샐러드&드레싱(1,2,5,6)",
          "(1324Kcal)",
          "B코너(6,000원)",
          "직화]돈까스김치나베(1,2,5,6,9,10,13,16)",
          "적은밥*차완무시(2)",
          "야채샐러드&드레싱(1,2,5,6)",
          "(1163Kcal)"
        ],
        "price": "5,500원",
        "kcal": ""
      },
      "dinner": {
        "hours": "",
        "items": [
          "쌀밥",
          "소고기우거지국(5,6,16)",
          "제육야채볶음(5,6,10)",
          "두부야채조림(5,6,10)",
          "조미김구이",
          "맛김치(5,6,9,13)",
          "야채샐러드&드레싱(1,2,5,6)",
          "(1273Kcal)",
          "추석 연휴 전 마감 청소로 인해 식사 마감 시간이 10분 일찍 종료됩니다.",
          "이용에 참고 부탁드립니다."
        ],
        "price": "5,500원",
        "kcal": ""
      }
    },
    {
      "id": "west",
      "name": "서맛골 W2",
      "building": "W2",
      "breakfast": {
        "hours": "",
        "items": [
          "백미밥",
          "맑은콩나물국(5,6)",
          "모둠장조림(5,6,10,16)",
          "양념깻잎지(5,6)",
          "도시락김(5,6)",
          "배추김치(5,9)",
          "누룽지",
          "앞으로는 간식이 제공되지 않으니, 이용에 참고 부탁드립니다.",
          "감사합니다."
        ],
        "price": "",
        "kcal": "680 kcal"
      },
      "lunch": {
        "hours": "",
        "items": [
          "백미밥",
          "된장찌개(5,6)",
          "간장찜닭(5,6,15)",
          "햄감자채볶음(5,6,10,15)",
          "오이부추무침(5,6)",
          "배추김치(5,9)",
          "양배추채샐러드&드레싱(1,6)",
          "[일품:6500원]",
          "뚝)치즈부대찌개&라면사리(2,5,6,10,15,16)",
          "추가밥",
          "단무지(5,6)",
          "배추김치(5,9)",
          "양배추채샐러드&드레싱(1,6)"
        ],
        "price": "500원",
        "kcal": "1010 kcal"
      },
      "dinner": {
        "hours": "",
        "items": [
          "백미밥",
          "온도토리묵국(5,6)",
          "제육볶음(5,6,10)",
          "브로콜리&초장(5,6)",
          "연근땅콩조림(4,5,6)",
          "배추김치(5,9)",
          "양배추채샐러드&드레싱(1,6)",
          "[일품:6500원]",
          "라구파스타(5,6,10,15,16)",
          "부어스트소세지(5,6,10,15,16)",
          "우동국물(5,6)",
          "단무지(5,6)",
          "양배추채샐러드&드레싱(1,6)",
          "[수요과일] 학생들의 영양 개선을 위해 고객경영팀에서 제공하는 과일입니다."
        ],
        "price": "500원",
        "kcal": "1120 kcal"
      }
    },
    {
      "id": "east1",
      "name": "동맛골 학생식당 E5",
      "building": "E5",
      "breakfast": {
        "hours": "",
        "items": [
          "(뚝)얼큰두부소고기탕5,6,16",
          "쌀밥",
          "닭다리살볶음 5,6,15",
          "계란후라이1,5,6",
          "오이고추된장무침 5,6",
          "깍두기2,5,6,9,12,15,16,18",
          "●하루과일 캠페인은 동문 및 학부모님 등의 후원으로 제공됩니다.(주관: 글로벌리더십센터)"
        ],
        "price": "",
        "kcal": "860 kcal"
      },
      "lunch": {
        "hours": "",
        "items": [
          "(한식)",
          "파김치제육볶음5,6,9,10",
          "쌀밥",
          "시금치고추장국5,6",
          "해물깻잎전*케찹17,5,6,1,9,16,18,12",
          "야채겉절이5,6",
          "배추김치6,9",
          "사과주스",
          "(일품)",
          "나시고랭볶음밥5,6,8,9,10,18,13,1",
          "시금치고추장국5,6",
          "볶음쌀국수5,6,13,18,16,1,2",
          "야채춘권*칠리소스6,12",
          "배추김치6,9",
          "사과주스",
          "(샐러드)"
        ],
        "price": "",
        "kcal": "643 kcal"
      },
      "dinner": {
        "hours": "",
        "items": [
          "중화제육덮밥5,10,1,5,6,10,15,16,17,18",
          "미역장국5,6",
          "야채고로케*케찹5,6,,12",
          "메밀비빔국수3,6,5",
          "배추김치6,9",
          "●고객경영팀에서 학생들의 건강을 위해 과일을 제공합니다."
        ],
        "price": "",
        "kcal": "1275 kcal"
      }
    },
    {
      "id": "east2",
      "name": "동맛골 교직원식당 E5",
      "building": "E5",
      "breakfast": {
        "hours": "",
        "items": [],
        "price": "",
        "kcal": ""
      },
      "lunch": {
        "hours": "",
        "items": [
          "(한식)",
          "파김치제육볶음5,6,9,10",
          "쌀밥",
          "시금치고추장국5,6",
          "해물깻잎전*케찹17,5,6,1,9,16,18,12",
          "야채겉절이5,6",
          "배추김치6,9",
          "약과5,6",
          "(솥밥)",
          "전복버터솥밥18,2,5,6",
          "시금치고추장국5,6",
          "오징어젓갈무침17,5,13",
          "무조미도시락김",
          "배추김치6,9"
        ],
        "price": "",
        "kcal": "870 kcal"
      },
      "dinner": {
        "hours": "",
        "items": [
          "중화제육덮밥5,10,1,5,6,10,15,16,17,18",
          "미역장국5,6",
          "야채고로케*케찹5,6,,12",
          "메밀비빔국수3,6,5",
          "배추김치6,9",
          "감자채피망볶음5",
          "●고객경영팀에서 학생들의 건강을 위해 과일을 제공합니다."
        ],
        "price": "",
        "kcal": "1275 kcal"
      }
    },
    {
      "id": "emp",
      "name": "교수회관 N6",
      "building": "N6",
      "breakfast": {
        "hours": "",
        "items": [],
        "price": "",
        "kcal": ""
      },
      "lunch": {
        "hours": "",
        "items": [
          "1층 자율배식",
          "(5,500원)",
          "쌀밥",
          "다시마무채국",
          "한방돈육장조림(5,6,10,18)",
          "한식잡채(5,6,10)",
          "무말랭이(13)",
          "맛김치(9,13)",
          "그린샐러드&드레싱(1,5,6)",
          "(1084kcal)",
          "2층 자율배식",
          "(6,500원)",
          "쌀밥",
          "다시마무채국",
          "한방돈육장조림(5,6,10,18)",
          "계란옷입은동그란땡전(1,5,6,10)"
        ],
        "price": "5,500원",
        "kcal": ""
      },
      "dinner": {
        "hours": "",
        "items": [
          "자율배식",
          "(5,500원)",
          "쌀밥",
          "계란파국(1)",
          "오징어야채볶음(5,6,17)",
          "고로케튀김&케찹(5,6,12)",
          "오복지무침(13)",
          "맛김치(9,13)",
          "그린샐러드&드레싱(1,5,6)",
          "(1101kcal)"
        ],
        "price": "5,500원",
        "kcal": ""
      }
    },
    {
      "id": "icc",
      "name": "문지캠퍼스",
      "building": "문지",
      "breakfast": {
        "hours": "",
        "items": [
          "백미밥",
          "소고기무국(5,6,16)",
          "야채계란찜(1)",
          "미역줄기볶음(5,6)",
          "도시락김",
          "배추김치",
          "[칼로리:630kcal]"
        ],
        "price": "",
        "kcal": ""
      },
      "lunch": {
        "hours": "",
        "items": [
          "백미밥",
          "김치찌개(5,6)",
          "고구마닭갈비(5,6,15)",
          "잡채어묵볶음(5,6,8,9,17)",
          "메밀전병(3,5,6,10)",
          "배추김치",
          "[칼로리:940kcal]"
        ],
        "price": "",
        "kcal": ""
      },
      "dinner": {
        "hours": "",
        "items": [
          "백미밥",
          "순두부찌개(1,5,6,9,10,18)",
          "돈육바베큐폭찹(5,6,10,12)",
          "연두부/양념장(5,6)",
          "마늘쫑지무침(5,6)",
          "배추김치",
          "[칼로리:850kcal]"
        ],
        "price": "",
        "kcal": ""
      }
    },
    {
      "id": "hawam",
      "name": "화암 기숙사",
      "building": "화암",
      "breakfast": {
        "hours": "",
        "items": [
          "백미밥",
          "소고기무국(5,6,16)",
          "야채계란찜(1)",
          "미역줄기볶음(5,6)",
          "도시락김",
          "배추김치",
          "[칼로리:630kcal]"
        ],
        "price": "",
        "kcal": ""
      },
      "lunch": {
        "hours": "",
        "items": [
          "백미밥",
          "김치찌개(5,6)",
          "고구마닭갈비(5,6,15)",
          "잡채어묵볶음(5,6,8,9,17)",
          "메밀전병(3,5,6,10)",
          "배추김치",
          "[칼로리:940kcal]"
        ],
        "price": "",
        "kcal": ""
      },
      "dinner": {
        "hours": "",
        "items": [
          "백미밥",
          "순두부찌개(1,5,6,9,10,18)",
          "돈육바베큐폭찹(5,6,10,12)",
          "연두부/양념장(5,6)",
          "마늘쫑지무침(5,6)",
          "배추김치",
          "[칼로리:850kcal]"
        ],
        "price": "",
        "kcal": ""
      }
    },
    {
      "id": "seoul",
      "name": "서울캠퍼스",
      "building": "서울",
      "breakfast": {
        "hours": "",
        "items": [],
        "price": "",
        "kcal": ""
      },
      "lunch": {
        "hours": "",
        "items": [
          "2층",
          "1코너",
          "순살감자탕",
          "잡곡밥",
          "팽이버섯두부간장조림",
          "참치야채볶음",
          "부추양파무침",
          "깍두기",
          "2코너",
          "잔치국수",
          "쌀밥",
          "미니메밀전병",
          "부추양파무침",
          "배추김치",
          "4층",
          "파개장(하얀육개장)"
        ],
        "price": "",
        "kcal": ""
      },
      "dinner": {
        "hours": "",
        "items": [
          "청양풍닭야채볶음",
          "쌀밥",
          "햄섞어찌개",
          "연근조림",
          "오이지무침",
          "깍두기"
        ],
        "price": "",
        "kcal": ""
      }
    }
  ]
}
