{
  "date": "2026-09-25",
  "dateLabel": "9월 25일",
  "fetchedAt": "2026-09-25T15:26:54+09:00",
  "source": "https://www.kaist.ac.kr/kr/html/campus/053001.html",
  "restaurants": [
    {
      "id": "west",
      "name": "서맛골 W2",
      "building": "W2",
      "breakfast": {
        "hours": "",
        "items": [
          "백미밥",
          "조랭이떡국 (1,5,6)",
          "산적조림 (5,6,10,15)",
          "오복지무침 (5,6)",
          "도시락김 (5,6)",
          "배추김치 (5,9)",
          "누룽지"
        ],
        "price": "",
        "kcal": "785 kcal"
      },
      "lunch": {
        "hours": "",
        "items": [
          "백미밥",
          "부대찌개 (5,6,9,10,15,16)",
          "돈까스&소스 (5,6,10,15)",
          "감자조림 (5,6)",
          "고추된장무침 (5,6)",
          "배추김치 (5,9)",
          "양배추샐러드&드레싱 (1,6)"
        ],
        "price": "",
        "kcal": "950 kcal"
      },
      "dinner": {
        "hours": "",
        "items": [
          "백미밥",
          "토란들깨국 (5,6)",
          "짬뽕불고기 (5,6,10)",
          "톳두부무침 (5,6)",
          "수제양파초절임 (5,6)",
          "배추김치 (5,9)",
          "양배추샐러드&드레싱 (1,6)"
        ],
        "price": "",
        "kcal": "850 kcal"
      }
    }
  ]
}
