{
  "date": "2026-09-28",
  "dateLabel": "9월 28일",
  "fetchedAt": "2026-09-29T00:49:00+09:00",
  "source": "https://www.kaist.ac.kr/kr/html/campus/053001.html",
  "status": "AVAILABLE",
  "coverage": {
    "requested": 8,
    "fetched": 8,
    "failed": [],
    "carried": []
  },
  "restaurants": [
    {
      "id": "fclt",
      "name": "카이마루 N11",
      "building": "N11",
      "breakfast": {
        "hours": "",
        "items": [
          "천원의 아침밥(1,000원) / 대학생, 대학원 재학생 대상 / 조식(3,500원) /*교직원 및 일반인에게는 과일제공이 제한됩니다.",
          "쌀밥",
          "시금치된장국(5,6)",
          "잡채어묵고추장볶음",
          "오복지무침(13)",
          "맛김치(5,6,9,13)",
          "도시락김/숭늉",
          "(683Kcal)"
        ],
        "price": "1,000원",
        "kcal": ""
      },
      "lunch": {
        "hours": "",
        "items": [
          "자율코너(5,500원)",
          "쌀밥/흑미밥",
          "돈육김치찌개",
          "순살돈까스*소스",
          "비엔나마늘볶음(1,5,6,18)",
          "해초무침",
          "깍두기(5,6,9,13)",
          "야채샐러드&드레싱(1,2,5,6)",
          "(1299Kcal)",
          "A코너(5,500원)",
          "떡갈비카레덮밥* 계란후라이",
          "얼라이브자몽",
          "야채샐러드&드레싱(1,2,5,6)",
          "(1147Kcal)",
          "B코너(5,500원)",
          "직화] 꼬치어묵우동"
        ],
        "price": "5,500원",
        "kcal": ""
      },
      "dinner": {
        "hours": "",
        "items": [
          "쌀밥",
          "콩나물국(5)",
          "제육야채볶음(5,6,10)",
          "연근조림(5,6)",
          "건새우마늘쫑볶음(9)",
          "맛김치(5,6,9,13)",
          "야채샐러드&드레싱(1,2,5,6)",
          "(1271Kcal)"
        ],
        "price": "5,500원",
        "kcal": ""
      }
    },
    {
      "id": "west",
      "name": "서맛골 W2",
      "building": "W2",
      "breakfast": {
        "hours": "",
        "items": [
          "백미밥",
          "배추된장국 (5,6)",
          "순두부&간장 (5,6)",
          "비타장아찌 (5,6)",
          "도시락김 (5,6)",
          "배추김치 (5,9)",
          "누룽지",
          "앞으로는 간식이 제공되지 않으니, 이용에 참고 부탁드립니다.",
          "감사합니다."
        ],
        "price": "",
        "kcal": "650 kcal"
      },
      "lunch": {
        "hours": "",
        "items": [
          "백미밥",
          "바지락미역국 (5,6,18)",
          "매콤돈육찜 (5,6,10)",
          "도토리묵무침 (5,6)",
          "해초샐러드 (5,6)",
          "배추김치 (5,9)",
          "양배추채샐러드&드레싱 (1,6)",
          "[일품: 6,500]",
          "짜장면&계란후라이 (1,5,6,10,16)",
          "추가밥",
          "바지락미역국 (5,6,18)",
          "탕수육&소스 (5,6,10,15)",
          "단무지 (5,6)",
          "양배추채샐러드&드레싱 (1,6)"
        ],
        "price": "",
        "kcal": "1150 kcal"
      },
      "dinner": {
        "hours": "",
        "items": [
          "백미밥",
          "사골물만둣국 (5,6,10,15,16)",
          "오징어두부두루치기 (5,6,17)",
          "콩나물무침 (5,6)",
          "새송이버섯볶음 (5,6)",
          "배추김치 (5,9)",
          "양배추채샐러드&드레싱 (1,6)",
          "일품 [₩6,500]",
          "돈코츠라멘 (1,5,6,10,15)",
          "추가밥",
          "타코야끼 (1,5,6,17)",
          "단무지 (5,6)",
          "배추김치 (5,9)",
          "양배추채샐러드&드레싱 (1,6)"
        ],
        "price": "",
        "kcal": "1050 kcal"
      }
    },
    {
      "id": "east1",
      "name": "동맛골 학생식당 E5",
      "building": "E5",
      "breakfast": {
        "hours": "",
        "items": [
          "쌀밥",
          "바지락미역국18",
          "동그랑땡엿장조림5,6,2,10,15,16",
          "계란찜1,5",
          "건파래자반5",
          "배추김치6,9",
          "●하루과일 캠페인은 동문 및 학부모님 등의 후원으로 제공됩니다.(주관: 글로벌리더십센터)"
        ],
        "price": "",
        "kcal": "780 kcal"
      },
      "lunch": {
        "hours": "",
        "items": [
          "(한식)",
          "순살닭볶음15,5,6",
          "쌀밥",
          "유부장국5,6",
          "비엔나양송이볶음5,6,15,16",
          "고추장마늘종무침13",
          "깍두기2,5,6,9,12,15,16,18",
          "그린샐러드*드레싱1,2,5,6,13,18",
          "(일품)",
          "부대덮밥6,9,15,10,5,6,16,2",
          "유부장국5,6",
          "어니언새우까스*소스6,9,17,1,2,5,13,16",
          "푸실리마요땅콩무침1,5",
          "깍두기2,5,6,9,12,15,16,18",
          "그린샐러드*드레싱1,2,5,6,13,18",
          "(샐러드)"
        ],
        "price": "",
        "kcal": "530 kcal"
      },
      "dinner": {
        "hours": "",
        "items": [
          "뚝)나주식곰탕2,5,6,15,16,18,1",
          "쌀밥",
          "쌀떡고기산적*머스타드10,15,16,2,5,6,1",
          "구멍어묵고추장조림5,6",
          "깍두기2,5,6,9,12,15,16,18"
        ],
        "price": "",
        "kcal": "1050 kcal"
      }
    },
    {
      "id": "east2",
      "name": "동맛골 교직원식당 E5",
      "building": "E5",
      "breakfast": {
        "hours": "",
        "items": [],
        "price": "",
        "kcal": ""
      },
      "lunch": {
        "hours": "",
        "items": [
          "(한식)",
          "순살닭볶음15,5,6",
          "쌀밥",
          "유부장국5,6",
          "비엔나양송이볶음5,6,15,16",
          "고추장마늘종무침13",
          "깍두기2,5,6,9,12,15,16,18",
          "지마구튀김5,6",
          "(솥밥)",
          "갈릭버터새우솥밥2,5,6,9",
          "유부장국5,6",
          "오징어젓갈무침17,5,13",
          "무조미도시락김",
          "배추김치6,9"
        ],
        "price": "",
        "kcal": "890 kcal"
      },
      "dinner": {
        "hours": "",
        "items": [
          "뚝)나주식곰탕2,5,6,15,16,18,1",
          "쌀밥",
          "쌀떡고기산적*머스타드10,15,16,2,5,6,1",
          "구멍어묵고추장조림5,6",
          "깍두기2,5,6,9,12,15,16,18",
          "미역줄기볶음5,6"
        ],
        "price": "",
        "kcal": "1050 kcal"
      }
    },
    {
      "id": "emp",
      "name": "교수회관 N6",
      "building": "N6",
      "breakfast": {
        "hours": "",
        "items": [],
        "price": "",
        "kcal": ""
      },
      "lunch": {
        "hours": "",
        "items": [
          "1층 자율배식",
          "(5,500원)",
          "잡곡밥",
          "시래기된장국(5)",
          "마파두부덮밥(5,6,10,18)",
          "모둠튀김&소스(6,18)",
          "간장고추지(13)",
          "맛김치(9,13)",
          "그린샐러드&드레싱(1,5,6)",
          "(1074kcal)",
          "2층 자율배식",
          "(6,500원)",
          "잡곡밥",
          "시래기된장국(5)",
          "마파두부덮밥(5,6,10,18)",
          "순살치킨간장강정(5,6,10,17)"
        ],
        "price": "5,500원",
        "kcal": ""
      },
      "dinner": {
        "hours": "",
        "items": [
          "자율배식",
          "(5,500원)",
          "추가밥/크림스프",
          "치킨까스&소스(5,6)",
          "알리오오일파스타(5,6,10,15,18)",
          "오이피클(13)",
          "맛김치(9,13)",
          "그린샐러드&드레싱(1,5,6)",
          "(1049kcal)"
        ],
        "price": "5,500원",
        "kcal": ""
      }
    },
    {
      "id": "icc",
      "name": "문지캠퍼스",
      "building": "문지",
      "breakfast": {
        "hours": "",
        "items": [
          "백미밥",
          "소고기미역국(5,6,16)",
          "두부부침(5,6)",
          "봉어묵야채볶음(1,5,6,9)",
          "도시락김",
          "배추김치",
          "[칼로리:710kcal]"
        ],
        "price": "",
        "kcal": ""
      },
      "lunch": {
        "hours": "",
        "items": [
          "백미밥",
          "육개장(5,6,16)",
          "제육볶음(5,6,10)",
          "생선까스/타르소스(1,2,5,6)",
          "숙주나물(5)",
          "배추김치",
          "[칼로리: 1,095kcal]"
        ],
        "price": "",
        "kcal": ""
      },
      "dinner": {
        "hours": "",
        "items": [
          "백미밥",
          "꼬지어묵국(1,5,6,9)",
          "치킨오븐구이(5,6,15)",
          "햄감자채볶음(1,2,5,6,10)",
          "오이양파무침(5,6)",
          "배추김치",
          "[칼로리:910kcal]"
        ],
        "price": "",
        "kcal": ""
      }
    },
    {
      "id": "hawam",
      "name": "화암 기숙사",
      "building": "화암",
      "breakfast": {
        "hours": "",
        "items": [
          "백미밥",
          "소고기미역국(5,6,16)",
          "두부부침(5,6)",
          "봉어묵야채볶음(1,5,6,9)",
          "도시락김",
          "배추김치",
          "[칼로리:710kcal]"
        ],
        "price": "",
        "kcal": ""
      },
      "lunch": {
        "hours": "",
        "items": [
          "백미밥",
          "육개장(5,6,16)",
          "제육볶음(5,6,10)",
          "생선까스/타르소스(1,2,5,6)",
          "숙주나물(5)",
          "배추김치",
          "[칼로리: 1,095kcal]"
        ],
        "price": "",
        "kcal": ""
      },
      "dinner": {
        "hours": "",
        "items": [
          "백미밥",
          "꼬지어묵국(1,5,6,9)",
          "치킨오븐구이(5,6,15)",
          "햄감자채볶음(1,2,5,6,10)",
          "오이양파무침(5,6)",
          "배추김치",
          "[칼로리:910kcal]"
        ],
        "price": "",
        "kcal": ""
      }
    },
    {
      "id": "seoul",
      "name": "서울캠퍼스",
      "building": "서울",
      "breakfast": {
        "hours": "",
        "items": [],
        "price": "",
        "kcal": ""
      },
      "lunch": {
        "hours": "",
        "items": [
          "2층",
          "1코너",
          "쇠고기순두부찌개",
          "잡곡밥",
          "청파래해물까스",
          "건파래볶음",
          "오이지무침",
          "깍두기",
          "2코너",
          "카레라이스",
          "계란파국",
          "핫도그",
          "오이지무침",
          "깍두기",
          "4층",
          "고등과학원 예약식"
        ],
        "price": "",
        "kcal": ""
      },
      "dinner": {
        "hours": "",
        "items": [
          "닭곰탕",
          "쌀밥",
          "너비아니구이",
          "감자채볶음",
          "양념깻잎지",
          "배추김치"
        ],
        "price": "",
        "kcal": ""
      }
    }
  ]
}
