{
  "date": "2026-09-22",
  "dateLabel": "9월 22일",
  "fetchedAt": "2026-09-22T15:37:43+09:00",
  "source": "https://www.kaist.ac.kr/kr/html/campus/053001.html",
  "restaurants": [
    {
      "id": "fclt",
      "name": "카이마루 N11",
      "building": "N11",
      "breakfast": {
        "hours": "",
        "items": [
          "천원의 아침밥(1,000원) 대학생, 대학원 재학생 대상 / 조식(3,500원) /*교직원 및 일반인에게는 과일 제공이 제한됩니다.",
          "쌀밥",
          "오징어무국(5,6,17)",
          "비엔나케찹볶음(1,5,6,12,15)",
          "미역오이무침",
          "맛김치(5,6,9,13)",
          "도시락김/숭늉",
          "(681Kcal)"
        ],
        "price": "1,000원",
        "kcal": ""
      },
      "lunch": {
        "hours": "",
        "items": [
          "자율코너(5,500원)",
          "콩나물버섯밥*양념장(5)",
          "다시마무국",
          "어니언치킨까스*소스(1,5,6,15)",
          "짬뽕두부짜글이(5,6,10,18)",
          "오복지무침(13)",
          "맛김치(5,6,9,13)",
          "야채샐러드&드레싱(1,2,5,6)",
          "(1300Kcal)",
          "A코너(5,500원) - 품절",
          "야끼소바파스타(1,5,6,10,18)",
          "돈카츠산도(1,2,5,6,10,12)",
          "야채샐러드&드레싱(1,2,5,6)",
          "(1168Kcal)",
          "B코너(6,000원)",
          "직화]얼큰돼지국밥(5,6,9,10,16)"
        ],
        "price": "5,500원",
        "kcal": ""
      },
      "dinner": {
        "hours": "",
        "items": [
          "쌀밥",
          "열무된장국(5,6)",
          "제육고추장볶음(5,6,10)",
          "오꼬노미어묵볶음(5,6)",
          "콩나물무침(5)",
          "맛김치(5,6,9,13)",
          "야채샐러드&드레싱(1,2,5,6)",
          "(1295Kcal)"
        ],
        "price": "5,500원",
        "kcal": ""
      }
    },
    {
      "id": "west",
      "name": "서맛골 W2",
      "building": "W2",
      "breakfast": {
        "hours": "",
        "items": [
          "백미밥",
          "물만둣국(5,6,10,15)",
          "계란찜(1,5,6)",
          "고춧잎무침(5,6)",
          "도시락김(5,6)",
          "배추김치(5,9)",
          "누룽지",
          "앞으로는 간식이 제공되지 않으니, 이용에 참고 부탁드립니다.",
          "감사합니다."
        ],
        "price": "",
        "kcal": "710 kcal"
      },
      "lunch": {
        "hours": "",
        "items": [
          "백미밥",
          "소고기무두부국(5,6,16)",
          "고구마닭갈비(5,6,15)",
          "동부묵김무침(5,6)",
          "숙주나물(5,6)",
          "배추김치(5,9)",
          "양배추샐러드&드레싱(1,6)",
          "[일품:6500원]",
          "쭈삼불고기&파채(5,6,10,17)",
          "추가밥",
          "소고기무두부국(5,6,16)",
          "콩나물무침(5,6)",
          "백김치(5,9)",
          "양배추샐러드&드레싱(1,6)"
        ],
        "price": "500원",
        "kcal": "930 kcal"
      },
      "dinner": {
        "hours": "",
        "items": [
          "백미밥",
          "김치수제비국(5,6,9)",
          "돈육폭찹(5,6,10)",
          "호박새우젓볶음(5,6,9)",
          "알감자조림(5,6)",
          "배추김치(5,9)",
          "양배추샐러드&드레싱(1,6)",
          "[일품:6500원]",
          "해물크림짬뽕(2,5,6,7,8,9,17,18,21)",
          "추가밥",
          "김치메밀전병(3,5,6,9,10,15)",
          "우동국물(5,6)",
          "단무지(5,6)",
          "양배추샐러드&드레싱(1,6)"
        ],
        "price": "500원",
        "kcal": "1060 kcal"
      }
    },
    {
      "id": "east1",
      "name": "동맛골 학생식당 E5",
      "building": "E5",
      "breakfast": {
        "hours": "",
        "items": [
          "(뚝)사골우거지국5,6,15,16",
          "쌀밥",
          "고등어구이7,5",
          "계란후라이1,5",
          "건파래볶음",
          "배추김치6,9",
          "●하루과일 캠페인은 동문 및 학부모님 등의 후원으로 제공됩니다.(주관: 글로벌리더십센터)"
        ],
        "price": "",
        "kcal": "855 kcal"
      },
      "lunch": {
        "hours": "",
        "items": [
          "(한식)",
          "마늘데리야끼닭살조림5,6,15",
          "쌀밥",
          "호박채맑은국5,6",
          "납작당면매콤잡채10,5,6",
          "미나리숙주나물",
          "배추김치6,9",
          "그린샐러드*드레싱1,2,5,6,13,18",
          "(일품)",
          "미트볼라따뚜이덮밥12,5,6,15,16,18,10",
          "호박채맑은국5,6",
          "패스츄리핫도그2,5,10,12,15,16,1,6",
          "리코타치즈만다린샐러드2,5,13,1",
          "배추김치6,9",
          "그린샐러드*드레싱1,2,5,6,13,18",
          "(샐러드)"
        ],
        "price": "",
        "kcal": "520 kcal"
      },
      "dinner": {
        "hours": "",
        "items": [
          "김밥볶음밥1,12,16,18,5,6,8,13",
          "꼬치어묵국5,6",
          "국물떡볶이1,5,6",
          "김말이튀김5,6,16",
          "배추김치6,9"
        ],
        "price": "",
        "kcal": "1087 kcal"
      }
    },
    {
      "id": "east2",
      "name": "동맛골 교직원식당 E5",
      "building": "E5",
      "breakfast": {
        "hours": "",
        "items": [],
        "price": "",
        "kcal": ""
      },
      "lunch": {
        "hours": "",
        "items": [
          "(한식)",
          "마늘데리야끼닭살조림5,6,15",
          "쌀밥",
          "호박채맑은국5,6",
          "납작당면매콤잡채10,5,6",
          "미나리숙주나물",
          "배추김치6,9",
          "곤약볼어묵조림5,6",
          "(솥밥)",
          "꽈리고추데리치킨솥밥15,5,6,13,18",
          "호박채맑은국5,6",
          "오징어젓갈무침17,5,13",
          "무조미도시락김",
          "배추김치6,9"
        ],
        "price": "",
        "kcal": "860 kcal"
      },
      "dinner": {
        "hours": "",
        "items": [
          "김밥볶음밥1,12,16,18,5,6,8,13",
          "꼬치어묵국5,6",
          "국물떡볶이1,5,6",
          "김말이튀김5,6,16",
          "배추김치6,9",
          "순대찜*소금2,5,6,10,12,16,18"
        ],
        "price": "",
        "kcal": "1087 kcal"
      }
    },
    {
      "id": "emp",
      "name": "교수회관 N6",
      "building": "N6",
      "breakfast": {
        "hours": "",
        "items": [],
        "price": "",
        "kcal": ""
      },
      "lunch": {
        "hours": "",
        "items": [
          "1층 자율배식",
          "(5,500원)",
          "쌀밥",
          "콩나물국(5)",
          "파채제육볶음(5,6,10)",
          "부추얼갈이겉절이",
          "간장무짠지채(13)",
          "맛김치(9,13)",
          "그린샐러드&드레싱(1,5,6)",
          "(1061kcal)",
          "2층 자율배식",
          "(6,500원)",
          "추가밥",
          "파채제육볶음(5,6,10)",
          "구포국수(1,5,6)",
          "부추얼갈이겉절이"
        ],
        "price": "5,500원",
        "kcal": ""
      },
      "dinner": {
        "hours": "",
        "items": [
          "자율배식",
          "(5,500원)",
          "쌀밥",
          "근대고추장국(5)",
          "미트볼케찹조림(5,6,10,12,15)",
          "백순대볶음(5,6,10)",
          "고추지무침(13)",
          "맛김치(9,13)",
          "그린샐러드&드레싱(1,5,6)",
          "(1078kcal)"
        ],
        "price": "5,500원",
        "kcal": ""
      }
    },
    {
      "id": "icc",
      "name": "문지캠퍼스",
      "building": "문지",
      "breakfast": {
        "hours": "",
        "items": [
          "백미밥",
          "두부김치국(5,9)",
          "돈육메알조림(1,5,6,0)",
          "꽈리고추어묵볶음(1,5,6)",
          "양념깻잎지(5,6)",
          "배추김치",
          "[칼로리:735kcal]"
        ],
        "price": "",
        "kcal": ""
      },
      "lunch": {
        "hours": "",
        "items": [
          "잡곡밥",
          "버섯된장찌개(5,6)",
          "고추장불고기(5,6,10)",
          "마파두부(5,6,10)",
          "양배추찜/쌈장(5,6)",
          "배추김치",
          "[칼로리:955kcal]"
        ],
        "price": "",
        "kcal": ""
      },
      "dinner": {
        "hours": "",
        "items": [
          "백미밥",
          "어묵무국(5,6,8,9,17)",
          "언양식불고기(5,6,16)",
          "생선까스/타르소스(1,5,6)",
          "콩나물맛살냉채(1,5,6,8)",
          "배추김치",
          "[칼로리:880kcal]"
        ],
        "price": "",
        "kcal": ""
      }
    },
    {
      "id": "hawam",
      "name": "화암 기숙사",
      "building": "화암",
      "breakfast": {
        "hours": "",
        "items": [
          "백미밥",
          "두부김치국(5,9)",
          "돈육메알조림(1,5,6,0)",
          "꽈리고추어묵볶음(1,5,6)",
          "양념깻잎지(5,6)",
          "배추김치",
          "[칼로리:735kcal]"
        ],
        "price": "",
        "kcal": ""
      },
      "lunch": {
        "hours": "",
        "items": [
          "잡곡밥",
          "버섯된장찌개(5,6)",
          "고추장불고기(5,6,10)",
          "마파두부(5,6,10)",
          "양배추찜/쌈장(5,6)",
          "배추김치",
          "[칼로리:955kcal]"
        ],
        "price": "",
        "kcal": ""
      },
      "dinner": {
        "hours": "",
        "items": [
          "백미밥",
          "어묵무국(5,6,8,9,17)",
          "언양식불고기(5,6,16)",
          "생선까스/타르소스(1,5,6)",
          "콩나물맛살냉채(1,5,6,8)",
          "배추김치",
          "[칼로리:880kcal]"
        ],
        "price": "",
        "kcal": ""
      }
    },
    {
      "id": "seoul",
      "name": "서울캠퍼스",
      "building": "서울",
      "breakfast": {
        "hours": "",
        "items": [],
        "price": "",
        "kcal": ""
      },
      "lunch": {
        "hours": "",
        "items": [
          "2층",
          "1코너",
          "닭개장",
          "잡곡밥",
          "감자떡완자전",
          "버섯잡채",
          "해초무침",
          "깍두기",
          "2코너",
          "왕돈까스",
          "쌀밥",
          "유부된장국",
          "오이피클",
          "양배추샐러드*드레싱",
          "깍두기",
          "4층"
        ],
        "price": "",
        "kcal": ""
      },
      "dinner": {
        "hours": "",
        "items": [
          "제육야채볶음덮밥",
          "탕파국",
          "떡맛탕",
          "브로콜리콩샐러드",
          "배추김치"
        ],
        "price": "",
        "kcal": ""
      }
    }
  ]
}
