{
  "date": "2026-10-10",
  "dateLabel": "10월 10일",
  "fetchedAt": "2026-10-08T09:38:17+09:00",
  "source": "https://www.kaist.ac.kr/kr/html/campus/053001.html",
  "status": "AVAILABLE",
  "coverage": {
    "requested": 8,
    "fetched": 8,
    "failed": [],
    "carried": []
  },
  "restaurants": [
    {
      "id": "fclt",
      "name": "카이마루 N11",
      "building": "N11",
      "breakfast": {
        "hours": "",
        "items": [
          "쌀밥",
          "북어채버섯국",
          "연두부찜*양념장(5,6)",
          "양념깻잎지(13)",
          "맛김치(5,6,9,13)",
          "도시락김/숭늉",
          "(669kcal)"
        ],
        "price": "3,500원",
        "kcal": ""
      },
      "lunch": {
        "hours": "",
        "items": [
          "자율배식(5,500원)",
          "쌀밥",
          "유채된장국(5,6)",
          "안동찜닭(5,6,15)",
          "그래놀라멸치볶음",
          "오복지(13)",
          "맛김치(5,6,9,13)",
          "야채샐러드&드레싱(1,2,5,6)",
          "(1311kcal)"
        ],
        "price": "5,500원",
        "kcal": ""
      },
      "dinner": {
        "hours": "",
        "items": [
          "쌀밥",
          "오징어무국(17)",
          "고기산적볶음(1,5,6,10,15)",
          "김말이강정(5,6,12)",
          "미역오이무침",
          "맛김치(5,6,9,13)",
          "야채샐러드&드레싱(1,2,5,6)",
          "(1289kcal)"
        ],
        "price": "5,500원",
        "kcal": ""
      }
    },
    {
      "id": "west",
      "name": "서맛골 W2",
      "building": "W2",
      "breakfast": {
        "hours": "",
        "items": [
          "백미밥",
          "배추된장국(5, 6)",
          "함박스테이크 (1, 6, 10, 15, 16)",
          "고들빼기무침(5,6)",
          "도시락김(5,6)",
          "배추김치(5,9)",
          "누룽지"
        ],
        "price": "",
        "kcal": "720 kcal"
      },
      "lunch": {
        "hours": "",
        "items": [
          "백미밥",
          "맑은콩나물국(5)",
          "매콤돈육찜 (5, 10)",
          "두부톳무침(5)",
          "수제양파고추지(5,6)",
          "배추김치(5,9)",
          "양배추샐러드&드레싱(1, 6)"
        ],
        "price": "",
        "kcal": "750 kcal"
      },
      "dinner": {
        "hours": "",
        "items": [
          "백미밥",
          "된장찌개(5,6)",
          "간장불고기(5, 10)",
          "양배추쌈&쌈장(5,6)",
          "무생채(5,6)",
          "배추김치(5,9)",
          "양배추샐러드&드레싱(1, 6)"
        ],
        "price": "",
        "kcal": "780 kcal"
      }
    },
    {
      "id": "east1",
      "name": "동맛골 학생식당 E5",
      "building": "E5",
      "breakfast": {
        "hours": "",
        "items": [
          "쌀밥",
          "쇠고기두부탕국5,6,16",
          "치킨너겟*머스타드1,2,5,6,12,15,16,18",
          "시금치프리타타1,5",
          "고들빼기무침9",
          "배추김치6,9"
        ],
        "price": "",
        "kcal": "800 kcal"
      },
      "lunch": {
        "hours": "",
        "items": [
          "얼큰순대국밥10,1,5,6,12,16,18",
          "쌀밥",
          "쌀떡고기데리야끼범벅5,6,2,10,15,16",
          "도토리묵상추무침5,6",
          "부추겉절이5,6",
          "깍두기5,6,2,9,16,15,12,18 총칼로리1,011kcal"
        ],
        "price": "",
        "kcal": ""
      },
      "dinner": {
        "hours": "",
        "items": [
          "쌀밥",
          "매콤어묵국5,6",
          "돈육김치볶음5,6,10",
          "모듬춘권*칠리소스6.5,12",
          "브로콜리참나물흑임자범벅1,2,4,5,6",
          "배추김치6,9"
        ],
        "price": "",
        "kcal": "910 kcal"
      }
    },
    {
      "id": "icc",
      "name": "문지캠퍼스",
      "building": "문지",
      "breakfast": {
        "hours": "",
        "items": [],
        "price": "",
        "kcal": ""
      },
      "lunch": {
        "hours": "",
        "items": [
          "계란야채볶음밥(1,2,5,6)",
          "꼬지어묵국(5,6)",
          "콩나물불고기(5,6,10)",
          "청포묵숙주무침(5,6)",
          "그린샐러드(1,2,5,6)",
          "배추김치",
          "[칼로리:990kcal]"
        ],
        "price": "",
        "kcal": ""
      },
      "dinner": {
        "hours": "",
        "items": [
          "백미밥",
          "근대된장국(5,6)",
          "안동찜닭(5,6,15*)",
          "메밀전병(3,5,6,10)",
          "콩나물무침(5,6)",
          "배추김치",
          "[칼로리:880kcal]"
        ],
        "price": "",
        "kcal": ""
      }
    },
    {
      "id": "hawam",
      "name": "화암 기숙사",
      "building": "화암",
      "breakfast": {
        "hours": "",
        "items": [],
        "price": "",
        "kcal": ""
      },
      "lunch": {
        "hours": "",
        "items": [
          "계란야채볶음밥(1,2,5,6)",
          "꼬지어묵국(5,6)",
          "콩나물불고기(5,6,10)",
          "청포묵숙주무침(5,6)",
          "그린샐러드(1,2,5,6)",
          "배추김치",
          "[칼로리:990kcal]"
        ],
        "price": "",
        "kcal": ""
      },
      "dinner": {
        "hours": "",
        "items": [
          "백미밥",
          "근대된장국(5,6)",
          "안동찜닭(5,6,15*)",
          "메밀전병(3,5,6,10)",
          "콩나물무침(5,6)",
          "배추김치",
          "[칼로리:880kcal]"
        ],
        "price": "",
        "kcal": ""
      }
    }
  ]
}
